,article_id,author,content,date,division,highlight,is_new,last_date,lead,media_desc,media_src,media_type,title,url
0,24832225,Piotr Moszyński  Paryż,"Wyniki wyborów europejskich we Francji potwierdzają tendencje, które zarysowały się już podczas wyborów prezydenckich i parlamentarnych w 2017 r.: zanik dotychczas dominujących partii z umiarkowanej prawicy i lewicy na rzecz skrajnej prawicy i bloku centrowo-liberalnego. Nowością jest gwałtowny wzrost wpływów ugrupowania Europa Ekologia-Zieloni (EELV).W 2017 r. Emmanuel Macron i jego partia Republika w Marszu (LREM) rozgromili rywali w wyborach prezydenckich i parlamentarnych, ze skrajną prawicą pod wodzą Marine Le Pen na czele. Ta ostatnia już wtedy była jedyną siłą zdolną do zagrożenia Macronowi. Dwie partie od dziesięcioleci sprawujące na przemian władzę we Francji – neogaulliści i socjaliści – zupełnie wypadły z gry, uzyskując wyniki na poziomie odpowiednio 14 i 6 proc.Po wyborach europejskich Partia Socjalistyczna nadal tkwi w okolicach 6 proc., a klasyczna prawica spadła niemal równie nisko, uzyskując zaledwie ok. 8 proc. głosów. Utrwala się zatem całkiem nowa konfiguracja francuskiej sceny politycznej. Główni rozgrywający to teraz skrajna prawica i skupiony wokół Macrona blok złożony z centroprawicy, centrolewicy i liberałów. Są to siły otwarcie się zwalczające i mało skłonne do kompromisów. Wzajemnie widzą w sobie ogromne zagrożenie dla żywotnych interesów Francji i Europy.",2019-05-27 10:23:00.000000,Świat,"Utrwala się całkiem nowa konfiguracja francuskiej sceny politycznej. Główni rozgrywający to teraz skrajna prawica i skupiony wokół prezydenta blok złożony z centroprawicy, centrolewicy i liberałów.",False,2019-06-01 09:30:24.871844,"Utrwala się całkiem nowa konfiguracja francuskiej sceny politycznej. Główni rozgrywający to teraz skrajna prawica i skupiony wokół prezydenta blok złożony z centroprawicy, centrolewicy i liberałów",Marine Le Pen,"https://bi.im-g.pl/im/24/8a/17/z24683812V,Marine-Le-Pen.jpg",image,"Czy wynik partii Macrona to sukces, czy porażka? Francuska skrajna prawica minimalnie wygrywa, Zieloni trzecią siłą w kraju","http://wyborcza.pl/7,75399,24832225,czy-wynik-partii-macrona-to-sukces-czy-porazka-francuska-skrajna.html"
1,24832122,tod,"Według oficjalnych już wyników ze wszystkich 123 obwodowych komisji w eurowyborach w Toruniu na KE zagłosowało 40 496 osób, czyli 52,08 proc. PiS poparło znacznie mniej wyborców: 24 951, czyli 32,09 proc. Na trzecim miejscu w Toruniu uplasowała się Wiosna 5504 głosy (7,08 proc.), a dalej Konfederacja – 3283 (4,22 proc.), Kukiz’15 – 2413 (3,1 proc.) i Lewica Razem – 1113 (1,43 proc.).W okręgu nr 2, czyli w województwie kujawsko-pomorskim, pełne wyniki Państwowa Komisja Wyborcza opublikowała już o 8 rano. KE zdobyła 305 tys. głosów, czyli 46,01 proc., a PiS 260 tys. – 39,24 proc.Dalsze miejsca zajęli: Wiosna – 5,94 proc., Kukiz'15 – 3,87 proc. i mająca niemal identyczne poparcie Konfederacja (3,8 proc.). Ostatnie miejsce, z wynikiem 1,14 proc. okupuje Lewica Razem.Eurowybory 2019 - relacja na żywo",2019-05-27 09:52:00.000000,Wiadomości z Torunia,W wyborach do Parlamentu Europejskiego w Toruniu Koalicja Europejska zdobyła aż o 20 proc. głosów więcej niż PiS.,False,2019-06-01 09:30:24.871844,W wyborach do Parlamentu Europejskiego w Toruniu Koalicja Europejska zdobyła aż o 20 proc. głosów więcej niż PiS.,"""Robimy następny krok i wygrywamy wybory w październiku"". Reakcje sztabu Koalicji Europejskiej na wyniki wyborów",blob:http://torun.wyborcza.pl/ab115ada-67b1-45ba-9cf7-d7d49fa3fbf1,video,Eurowybory 2019: w Toruniu Koalicja Europejska dostała 52 proc. głosów,"http://torun.wyborcza.pl/torun/7,48723,24832122,eurowybory-2019-w-toruniu-koalicja-europejska-ma-ponad-50-proc.html"
2,24832068,Janusz Kędracki,"W Osieku na Koalicje Europejską głosowało zaledwie 9,49 proc. wyborców.Prawo i Sprawiedliwość zdecydowanie wygrywało wybory w większości gmin wiejskich i małych miastach.Poza Osiekiem bardzo duże poparcie miało w Łubnicach (także powiat staszowski) – 79,02 proc., Baćkowicach (opatowski) – 78,93 i Pawłowie (starachowicki) – 78,91. Ponad 75 proc. głosów kandydaci z listy PiS zebrali jeszcze w 11 gminach: Gnojno i Tuczępy (buski), Małogoszcz (jędrzejowski), Łagów i Mniów (kielecki), Fałków i Smyków (konecki), Iwaniska (opatowski), Waśniów (ostrowiecki), Bogoria (staszowski) i Kluczewsko (włoszczowski). W kolejnych 27 gminach na PiS głosowało od 70 do 75 proc. wyborców.Koalicja Europejska zwyciężyła tylko w Kielcach. Zdobyła tu 43,71 proc. głosów (PiS – 41,75 proc.). Wyrównane wybory były też w Sandomierzu – na PiS głosowało 43,70 proc., na KE 41,24 proc.",2019-05-27 09:46:00.000000,eurowybory 2019,"Wybory do europarlamentu 2019. Rekordowe poparcie dla Prawa i Sprawiedliwości w gminie Osiek w powiecie staszowskim. Na kandydatów tego ugrupowania oddano tam w niedzielę 83,2 proc. głosów.",False,2019-06-01 09:30:24.871844,"Wybory do europarlamentu 2019. Rekordowe poparcie dla Prawa i Sprawiedliwości w gminie Osiek w powiecie staszowskim. Na kandydatów tego ugrupowania oddano tam w niedzielę 83,2 proc. głosów.","Nie ma trzeciej siły, katastrofa lewicy, będzie nowa partia? [Skarżyńska, Markowski i Raciborski komentują wynik exit polls]",blob:http://kielce.wyborcza.pl/b621801a-f104-4295-8bfb-a4bc64bd20e3,video,Wybory do europarlamentu 2019. Rekord w gminie: 83 proc. osób zagłosowało na PiS,"http://kielce.wyborcza.pl/kielce/7,47262,24832068,wybory-do-europarlamentu-2019-rekord-w-gminie-83-proc-osob.html"
3,24832047,Michał Tokarczyk,"WYBORY DO EUROPARLAMENTU - RELACJA NA ŻYWOFrekwencja w Gdańsku wynosiła 55,94 proc. i była jedną z najwyższych w kraju. To także lepszy wynik niż w 2014 roku. Wówczas głos oddało 35,94 proc. uprawnionych do głosowania mieszkańców. W Gdańsku Koalicja Europejska wręcz znokautowała swoich rywali – głosowało na nią 60,29 proc. mieszkańców. PiS zdobył 26,53 proc., a Wiosna – 4,9 proc. Tuż za ugrupowaniem Roberta Biedronia znalazła się Konfederacja z 4,09 proc.głosów.Na kolejnych miejscach w Gdańsku są: Kukiz'15 – 2,2 proc. i Lewica Razem – 1 proc.Koalicja Europejska powinna być zadowolona z rezultatu w Gdańsku. Jej wynik odzwierciedla bowiem sympatie wyborców z 2014 r. Wówczas Platforma Obywatelska dostała 54,1 proc., SLD 6,86 proc, a PSL – 1,58 proc. PiS w poprzednich wyborach zdobył 23,33 proc. Prawdopodobnie wynik poprawił dzięki wyborcom Jarosława Gowina i Zbigniewa Ziobry – w 2014 r. obaj startowali osobno i zdobyli po 1 proc. ",2019-05-27 09:55:00.000000,wybory do europarlamentu 2019,Wybory do europarlamentu 2019. W Gdańsku Koalicja Europejska zdystansowała Prawo i Sprawiedliwość. Frekwencja była dużo wyższa niż pięć lat temu.,False,2019-06-01 09:30:24.871844,Wybory do europarlamentu 2019. W Gdańsku Koalicja Europejska zdystansowała Prawo i Sprawiedliwość. Frekwencja była dużo wyższa niż pięć lat temu.,,https://bi.im-g.pl/im/33/ae/17/z24830515V.jpg,image,Wybory do europarlamentu. Koalicja Europejska nokautuje PiS w Gdańsku,"http://trojmiasto.wyborcza.pl/trojmiasto/7,35612,24832047,wybory-do-europarlamentu-koalicja-europejska-nokautuje-pis.html"
4,24832070,Maciej Czarnecki,"Po przeliczeniu głosów w 10 z 12 regionów Partia Brexit miała 33,3 proc., proeuropejscy liberalni demokraci 20,9 proc., główna dotąd siła opozycyjna Partia Pracy 14,6 proc., a Partia Zielonych 12,5 proc. Rządzący konserwatyści byli dopiero na piątym miejscu z 8,8 proc. Stawkę uzupełniały nowa proeuropejska partia Change UK i eurosceptyczna UKIP, czyli Partia Niepodległości Zjednoczonego Królestwa (po 3,5 proc.).Szkocja nie ogłosiła jeszcze wyników, ale głosy Szkockiej Partii Narodowej też powinny przełożyć się na blisko 3,5 proc. w skali kraju. Walijska Plaid Cymru dostała w skali kraju 1 proc.– Zwyciężyliśmy w dość dramatycznym stylu z ważnym, prostym przekazem: dwie [główne] partie zawiodły, złamały swoje obietnice – powiedział BBC europoseł i naczelny eurosceptyk kraju Nigel Farage.",2019-05-27 09:56:00.000000,eurowybory,"Brytyjczycy odwrócili się w eurowyborach od głównych partii. Co trzeci zagłosował na nową eurosceptyczną Partię Brexit Nigela Farage'a, co piąty na proeuropejskich liberalnych demokratów.",False,2019-06-01 09:30:24.871844,"Brytyjczycy odwrócili się w eurowyborach od głównych partii. Co trzeci zagłosował na nową eurosceptyczną Partię Brexit Nigela Farage'a, co piąty na proeuropejskich liberalnych demokratów.",Wyniki wyborów do Europarlamentu w Wielkiej Brytanii. Partia Brexit na prowadzeniu,"https://bi.im-g.pl/im/f1/ae/17/z24831729V,Wyniki-wyborow-do-Europarlamentu-w-Wielkiej-Brytan.jpg",image,Najdziwniejsze wybory: partia Brexit kontra antybrexit. Tych drugich jest trochę więcej,"http://wyborcza.pl/7,75399,24832070,najdziwniejsze-wybory-partia-brexit-kontra-antybrexit-tych.html"
5,24832016,Jakub Chełmiński,"Państwowa Komisja Wyborcza podliczyła już 99 proc. głosów oddanych w wyborach do Parlamentu Europejskiego w okręgu 4, obejmującym Warszawę oraz wianuszek podstołecznych powiatów. Wyniki w samej Warszawie znacznie odbiegają od tych w całej Polsce, gdzie wygrało Prawo i Sprawiedliwość.Warszawiacy co drugi głos oddali na Koalicję Europejską. Prawo i Sprawiedliwość jest drugie, ale partię Jarosława Kaczyńskiego poparło prawie o 200 tys. osób mniej. Mocne trzecie miejsce ma Wiosna Roberta Biedronia – głosowało na nią 88 tys. osób, czyli ponad 10 proc. głosujących.Koalicja tradycyjnie najlepszy wynik miała w Wilanowie (61 proc.), na Ursynowie (56 proc.) i Mokotowie (53 proc.). Najsłabiej w zaniedbanych inwestycyjnie dzielnicach: na Pradze-Północ (41), Targówku (43), Ursusie (44). Wynik PiS rozkłada się odwrotnie niż KE. Ciekawe za to jest poparcie dla Wiosny. Najwięcej zwolenników udało się przyciągnąć Robertowi Biedroniowi na Żoliborzu (12,28), Białołęce (11,66) i w Śródmieściu (11,47).",2019-05-27 09:38:00.000000,eurowybory 2019,"Połowa głosów oddanych w Warszawie przypadła Koalicji Obywatelskiej. PiS zajmuje drugie miejsce, Wiosna mocne trzecie.",False,2019-06-01 09:30:24.871844,"Połowa głosów oddanych w Warszawie przypadła Koalicji Obywatelskiej. PiS zajmuje drugie miejsce, Wiosna mocne trzecie.",Wyniki wyborów do europarlamentu 2019,"https://bi.im-g.pl/im/e1/ae/17/z24830433V,Wyniki-wyborow-do-europarlamentu-2019.jpg",image,Wyniki wyborów do europarlamentu. W Warszawie 50 proc. dla Koalicji Europejskiej,"http://warszawa.wyborcza.pl/warszawa/7,54420,24832016,wyniki-wyborow-do-europarlamentu-w-warszawie-50-proc-dla-koalicji.html"
6,24832179,Janusz Kędracki,"Czwarte miejsce w mieście zajęła pierwsza na liście Koalicji Europejskiej Róża Thun, na którą zagłosowało 10 171 kielczan. Pozostali kandydaci cieszyli się już znacznie mniejszym poparciem. Piąty był Dominik Tarczyński (PiS) z 4213 głosami, szósty Adam Cyrański (KE) – 4049, siódma Anna Krupka (PiS) – 2831, ósme Andrzej Szejna (KE) – 2815, a dziewiąte Ryszard Legutko (PiS) – 2275.Ponad tysiąc głosów zebrali jeszcze: Konrad Berkowicz (Konfederacja) – 1904, Maciej Gdula (Wiosna) – 1565, Paweł Kukiz-Szczuciński (Kukiz’15) – 1496, Dawid Lewicki (Konfederacja) – 1198 i Małgorzata Marenin (Wiosna) – 1146.W całym okręgu małopolsko-świętokrzyskim rekordowym poparciem cieszyła się Beata Szydło, na którą zagłosowało ok. 525 tys. osób. 257 tys. zebrał drugi Patryk Jaki, 221 tys. Róża Thun, 138 tys. Adam Jarubas, ponad 65 tys. Ryszard Legutko, prawie 54 tys. Bogusław Sonik z KE, ok. 42 tys. Tarczyński, 29 tys. Arkadiusz Mularczyk z PiS, 23 tys. Anna Krupka.",2019-05-27 10:23:00.000000,Wiadomości z Kielc,Wybory do europarlamentu 2019. Adam Jarubas z Koalicji Europejskiej otrzymał najwięcej głosów w Kielcach 16 731. Lider świętokrzyskiego PSL wyprzedził kandydatów z listy PiS Patryka Jakiego (13 108) i Beatę Szydło (10 406).,False,2019-06-01 09:30:24.871844,Wybory do europarlamentu 2019. Adam Jarubas z Koalicji Europejskiej otrzymał najwięcej głosów w Kielcach 16 731. Lider świętokrzyskiego PSL wyprzedził kandydatów z listy PiS Patryka Jakiego (13 108) i Beatę Szydło (10 406).,Adam Jarubas,"https://bi.im-g.pl/im/f8/9c/17/z24757496V,Adam-Jarubas.jpg",image,Wybory do europarlamentu 2019. W Kielcach wygrał Jarubas przed Jakim i Szydło,"http://kielce.wyborcza.pl/kielce/7,47262,24832179,wybory-do-europarlamentu-2019-w-kielcach-wygral-jarubas-przed.html"
7,24831997,Paweł Rutkiewicz,"Chcesz dostawać mailem serwis z najważniejszymi informacjami z Łodzi? Zapisz się na nasz bezpłatny newsletter.Przy ogólnokrajowej frekwencji na poziomie 45,42 procent w Łodzi zagłosowało 53,33 uprawnionych. Łącznie było to 273 134 wyborców, z których Koalicję Europejską poparło 147 397. Tak wynika z danych, które po przeanalizowaniu głosów z 312 na 319 obwodowych komisji wyborczych w Łodzi opublikowała Państwowa Komisja Wyborcza.CZYTAJ TAKŻE: Wybory do Parlamentu Europejskiego. PiS wygrywa [WYNIKI EXIT POLL]W Łodzi spośród prawie 150 tys. wyborców KE aż 79 471 osób zagłosowało na Marka Belkę, a 51 847 na Joannę Skrzydlewską.Z kolei na Prawo i Sprawiedliwość w Łodzi głos oddało 82 725 osób, z czego 39 280 na Witolda Waszczykowskiego, a 31 802 na Joannę Kopcińską.Na Wiosnę Roberta Biedronia zagłosowało w Łodzi 6,82 proc., czyli 18 634 wyborców. Najwięcej, bo 9 994 osoby na ""jedynkę"" - Anitę Sowińską.",2019-05-27 10:15:00.000000,eurowybory 2019,"Gdyby w wyborach do europarlamentu 2019 głosowała tylko Łódź, Koalicja Europejska wygrałaby z PiS w stosunku 54 do 30 procent. KE dostało prawie 150 tys. głosów. W regionie wygrał PiS, ale najwięcej głosów zdobył Marek Belka.",False,2019-06-01 09:30:24.871844,"Gdyby w wyborach do europarlamentu 2019 głosowała tylko Łódź, Koalicja Europejska wygrałaby z PiS w stosunku 54 do 30 procent. KE dostało prawie 150 tys. głosów. W regionie wygrał PiS, ale najwięcej głosów zdobył Marek Belka.","""Robimy następny krok i wygrywamy wybory w październiku"". Reakcje sztabu Koalicji Europejskiej na wyniki wyborów",blob:http://lodz.wyborcza.pl/bb19ed55-6cce-4c95-b64a-fba4af25d6da,video,"Wybory do europarlamentu 2019. Łódź zdecydowanie za KE, a najwięcej głosów w województwie dostał Marek Belka","http://lodz.wyborcza.pl/lodz/7,35136,24831997,wybory-do-europarlamentu-2019-lodz-zdecydowanie-za-ke-ale.html"
8,24832225,Piotr Moszyński  Paryż,"Wyniki wyborów europejskich we Francji potwierdzają tendencje, które zarysowały się już podczas wyborów prezydenckich i parlamentarnych w 2017 r.: zanik dotychczas dominujących partii z umiarkowanej prawicy i lewicy na rzecz skrajnej prawicy i bloku centrowo-liberalnego. Nowością jest gwałtowny wzrost wpływów ugrupowania Europa Ekologia-Zieloni (EELV).W 2017 r. Emmanuel Macron i jego partia Republika w Marszu (LREM) rozgromili rywali w wyborach prezydenckich i parlamentarnych, ze skrajną prawicą pod wodzą Marine Le Pen na czele. Ta ostatnia już wtedy była jedyną siłą zdolną do zagrożenia Macronowi. Dwie partie od dziesięcioleci sprawujące na przemian władzę we Francji – neogaulliści i socjaliści – zupełnie wypadły z gry, uzyskując wyniki na poziomie odpowiednio 14 i 6 proc.Po wyborach europejskich Partia Socjalistyczna nadal tkwi w okolicach 6 proc., a klasyczna prawica spadła niemal równie nisko, uzyskując zaledwie ok. 8 proc. głosów. Utrwala się zatem całkiem nowa konfiguracja francuskiej sceny politycznej. Główni rozgrywający to teraz skrajna prawica i skupiony wokół Macrona blok złożony z centroprawicy, centrolewicy i liberałów. Są to siły otwarcie się zwalczające i mało skłonne do kompromisów. Wzajemnie widzą w sobie ogromne zagrożenie dla żywotnych interesów Francji i Europy.",2019-05-27 10:23:00.000000,Świat,"Utrwala się całkiem nowa konfiguracja francuskiej sceny politycznej. Główni rozgrywający to teraz skrajna prawica i skupiony wokół prezydenta blok złożony z centroprawicy, centrolewicy i liberałów.",False,2019-06-01 09:30:24.871844,"Utrwala się całkiem nowa konfiguracja francuskiej sceny politycznej. Główni rozgrywający to teraz skrajna prawica i skupiony wokół prezydenta blok złożony z centroprawicy, centrolewicy i liberałów.",Marine Le Pen,"https://bi.im-g.pl/im/24/8a/17/z24683812V,Marine-Le-Pen.jpg",image,"Czy wynik partii Macrona to sukces, czy porażka? Francuska skrajna prawica minimalnie wygrywa, Zieloni trzecią siłą w kraju","http://wyborcza.pl/7,75399,24832225,czy-wynik-partii-macrona-to-sukces-czy-porazka-francuska-skrajna.html"
